tweet_text,date_created,country,latitude,longitude,url
This dance marathon also has bounce houses. @ James A. Rhodes Arena https://t.co/OOqBbeBA0D,Sat Apr 14 17:24:00 +0000 2018,United States,-81.628444,40.995137,https://t.co/OOqBbeBA0D
White boy pulled those river dance moves out with the quickness https://t.co/FpAUfd5kKD,Sat Apr 14 17:23:23 +0000 2018,United States,-74.255641,40.495865,https://t.co/FpAUfd5kKD
"Conservatory Dance Company: Spring Dance Concert
                            George R. White Dance Complex, Pittsbu… https://t.co/kSQIFUOeHr",Sat Apr 14 17:22:15 +0000 2018,United States,-80.095586,40.3615796,https://t.co/kSQIFUOeHr
My birthday present from Alexander.   Living room dance party happening right now chez nous. https://t.co/I4K3IsqCp8,Sat Apr 14 17:21:28 +0000 2018,United States,-83.200169,39.832013,
"Adventists are some creative people. We can’t dance, but we can have rhythmic movements with sticks and ribbons? JUST DANCE lol",Sat Apr 14 17:21:14 +0000 2018,United States,-86.36849,41.89966,
"I'm at Kercheval Dance in Grosse Pointe, MI https://t.co/k7gp5cU6O7",Sat Apr 14 17:20:37 +0000 2018,United States,-82.922419,42.378787,https://t.co/k7gp5cU6O7
"“I’d rather dance than march” - Hannah Ryan, an animal nurse from Boston #MarchForScience https://t.co/HudJBAiZRt",Sat Apr 14 17:18:51 +0000 2018,United States,-71.191421,42.227797,
